{
  "completed_at": "2026-07-10T01:06:57Z",
  "crawl_run_id": "crawlrun_777aeb8985d5a4e55bfd8ffa",
  "crawler": {
    "config_hash": "sha256:dda2f6112ebc22541ee2c5148a5d5698c94e24e91d88ae7df35c5d968c4499d1",
    "git_commit": "unknown",
    "name": "docs-to-data-to-lora-stage0",
    "version": "v1"
  },
  "metrics": {
    "passage_count": 498,
    "raw_chunk_count": 2086,
    "url_registry_matched_url_count": 0,
    "url_registry_record_count": 0
  },
  "outputs": {
    "delta_manifest_uri": null,
    "source_chunks_uri": "provenance/source_chunks.jsonl",
    "source_revisions_uri": "provenance/source_revisions.jsonl"
  },
  "previous_crawl_run_id": null,
  "recrawl_reason": "initial",
  "schema_version": "provenance.v1",
  "scope": {
    "allowed_url_prefixes": [],
    "binary_host_allowlist": [],
    "excluded_url_patterns": [],
    "seed_url_set_hash": "sha256:7440bb63388a917f0224ebd10c0c7f73c5418ae06142e75a79df641fed6d7f25"
  },
  "started_at": "2026-07-10T01:06:54Z",
  "status": "completed"
}
